{
  "assurance_modules": [
    {
      "evidence_types": [
        {
          "description": "Record of the authority decision for an action class, resource, environment, configuration identity, duration, and purpose.",
          "id": "EV-AUTH-ADR",
          "label": "Authority Decision Record"
        },
        {
          "description": "The grant plus evaluated attributes and their freshness timestamps.",
          "id": "EV-AUTH-GRANT",
          "label": "Grant and evaluated attributes with freshness"
        },
        {
          "description": "The exact proposed effect or diff shown to an approver.",
          "id": "EV-AUTH-PROPOSAL",
          "label": "Exact proposal/diff"
        },
        {
          "description": "An attributable human release through an authenticated mechanism the producing agent cannot rewrite.",
          "id": "EV-AUTH-RELEASE",
          "label": "Authenticated release"
        },
        {
          "description": "Evidence of the state before and after an effect, or of the produced output.",
          "id": "EV-AUTH-PRESTATE-POSTSTATE",
          "label": "Prestate/poststate or output evidence"
        },
        {
          "description": "Readback proving that a stop or revocation actually took effect.",
          "id": "EV-AUTH-STOP-REVOCATION",
          "label": "Stop/revocation readback"
        },
        {
          "description": "Record of overrides, denials, and the final disposition of an authority event.",
          "id": "EV-AUTH-OVERRIDE-DENIAL",
          "label": "Overrides, denials, and disposition"
        }
      ],
      "governing_question": "Who may cause, approve, stop, or own each effect?",
      "implementation_slots": [
        "SLOT-02-POLICY-DECISION",
        "SLOT-03-IDENTITY-CREDENTIAL",
        "SLOT-05-TOOL-CONNECTOR",
        "SLOT-01-HUMAN-PROCEDURE",
        "SLOT-09-OPS-MONITORING"
      ],
      "metrics": [
        {
          "id": "MET-AUTH-UNAUTHORIZED",
          "metric": "Accepted unauthorized or out-of-scope effects",
          "threshold": "0"
        },
        {
          "id": "MET-AUTH-DENIAL-BYPASS",
          "metric": "Denial/bypass attempt rate, approval/denial/override rates, review latency, reversals, stale grants, failed revocations",
          "threshold": "Threshold breach narrows, freezes, rotates, or suspends; never lowers the bar"
        }
      ],
      "module": "Authority & human oversight",
      "module_id": "MOD-AUTH",
      "source_ref": "kit/assurance/authority-human-oversight.md"
    },
    {
      "evidence_types": [
        {
          "description": "The versioned acceptance criteria, materiality, negative cases, and critical-regression rules fixed before execution.",
          "id": "EV-QUAL-CRITERIA",
          "label": "Criteria version"
        },
        {
          "description": "Identity/digest of producer output frozen before checking.",
          "id": "EV-QUAL-FIXED-OUTPUT",
          "label": "Fixed output identity"
        },
        {
          "description": "Inputs and results of deterministic oracles.",
          "id": "EV-QUAL-ORACLE",
          "label": "Oracle inputs/results"
        },
        {
          "description": "Identity, context, configuration, and separation proof of the checker.",
          "id": "EV-QUAL-CHECKER",
          "label": "Checker identity, context, configuration, and separation proof"
        },
        {
          "description": "Register of every kept discrepancy with classification and disposition.",
          "id": "EV-QUAL-DISCREPANCY",
          "label": "Discrepancy register"
        },
        {
          "description": "Attributable human disposition of a quality outcome.",
          "id": "EV-QUAL-HUMAN-DISPOSITION",
          "label": "Human disposition"
        },
        {
          "description": "Record of reruns or remediation actions taken.",
          "id": "EV-QUAL-RERUN",
          "label": "Rerun or remediation record"
        }
      ],
      "governing_question": "What proves the output or effect is correct enough?",
      "implementation_slots": [
        "SLOT-07-VERIFICATION-DISPOSITION",
        "SLOT-06-SOURCE-TARGET",
        "SLOT-01-HUMAN-PROCEDURE"
      ],
      "metrics": [
        {
          "id": "MET-QUAL-REGRESSION",
          "metric": "Critical regressions",
          "threshold": "0"
        },
        {
          "id": "MET-QUAL-ORACLE-FAILURE",
          "metric": "Unexplained oracle failures",
          "threshold": "0"
        },
        {
          "id": "MET-QUAL-ACCEPTED-RATE",
          "metric": "Accepted-output rate, false accept/reject findings, discrepancy age, reviewer reversal, checker disagreement",
          "threshold": "Threshold breach returns to Stage 3 or 4 and blocks promotion"
        }
      ],
      "module": "Quality & verification",
      "module_id": "MOD-QUALITY",
      "source_ref": "kit/assurance/quality-verification.md"
    },
    {
      "evidence_types": [
        {
          "description": "References to work order, source, configuration, execution, effect, verification, exception, and disposition.",
          "id": "EV-EVID-INPUT-REF",
          "label": "Input and configuration references"
        },
        {
          "description": "Retained artifacts and their digests.",
          "id": "EV-EVID-ARTIFACTS",
          "label": "Retained artifacts and digests"
        },
        {
          "description": "Readbacks from source and target systems.",
          "id": "EV-EVID-READBACK",
          "label": "Source/effect readbacks"
        },
        {
          "description": "Deterministic links across the evidence population.",
          "id": "EV-EVID-GRAPH",
          "label": "Relationship graph"
        },
        {
          "description": "Links to exceptions and waivers.",
          "id": "EV-EVID-WAIVER-LINKS",
          "label": "Exception and waiver links"
        },
        {
          "description": "Honest classification of custody; hashes and append-oriented files do not establish immutability.",
          "id": "EV-EVID-CUSTODY",
          "label": "Custody classification"
        },
        {
          "description": "Reconciliation of the full acceptance-critical population; absence is unknown, not zero.",
          "id": "EV-EVID-POPULATION",
          "label": "Population reconciliation"
        },
        {
          "description": "Result of non-producer reconstruction and its disposition.",
          "id": "EV-EVID-RECONSTRUCTION",
          "label": "Reconstruction result and disposition"
        }
      ],
      "governing_question": "Can a non-producer reconstruct inputs, decisions, effects, and disposition?",
      "implementation_slots": [
        "SLOT-06-SOURCE-TARGET",
        "SLOT-08-EVIDENCE-RETENTION",
        "SLOT-07-VERIFICATION-DISPOSITION"
      ],
      "metrics": [
        {
          "id": "MET-EVID-COMPLETENESS",
          "metric": "Acceptance-critical population completeness",
          "threshold": "100%"
        },
        {
          "id": "MET-EVID-BROKEN-LINKS",
          "metric": "Broken required links",
          "threshold": "0"
        },
        {
          "id": "MET-EVID-MISMATCH",
          "metric": "Unexplained source/effect mismatches",
          "threshold": "0"
        }
      ],
      "module": "Evidence & traceability",
      "module_id": "MOD-EVIDENCE",
      "source_ref": "kit/assurance/evidence-traceability.md"
    },
    {
      "evidence_types": [
        {
          "description": "Inventory of identities and grants with owner, purpose, environment, scope, credential reference, configuration identity, expiry, recertification date, and lifecycle state.",
          "id": "EV-IDEN-INVENTORY",
          "label": "Identity/grant inventory"
        },
        {
          "description": "The delegation chain with no-amplification proof.",
          "id": "EV-IDEN-DELEGATION",
          "label": "Owner/purpose and delegation chain"
        },
        {
          "description": "Data classification and approved data routes.",
          "id": "EV-IDEN-DATA-CLASS",
          "label": "Data classification and approved routes"
        },
        {
          "description": "Credential and execution/egress boundary configuration.",
          "id": "EV-IDEN-BOUNDARY-CONFIG",
          "label": "Credential and boundary configuration"
        },
        {
          "description": "Tests of the actual execution and egress boundaries relied upon.",
          "id": "EV-IDEN-ISOLATION-TEST",
          "label": "Isolation/egress tests"
        },
        {
          "description": "Periodic access review records.",
          "id": "EV-IDEN-ACCESS-REVIEW",
          "label": "Access review"
        },
        {
          "description": "Explicit change or novation decision.",
          "id": "EV-IDEN-NOVATION",
          "label": "Change/novation decision"
        },
        {
          "description": "Source-system readback proving suspension, revocation, or retirement.",
          "id": "EV-IDEN-LIFECYCLE-READBACK",
          "label": "Suspension/revocation/retirement readback"
        }
      ],
      "governing_question": "Who is acting, through which boundary, on what data, under which rules?",
      "implementation_slots": [
        "SLOT-03-IDENTITY-CREDENTIAL",
        "SLOT-02-POLICY-DECISION",
        "SLOT-04-EXECUTION-BOUNDARY",
        "SLOT-05-TOOL-CONNECTOR",
        "SLOT-06-SOURCE-TARGET"
      ],
      "metrics": [
        {
          "id": "MET-IDEN-ORPHAN",
          "metric": "Active orphan identities",
          "threshold": "0"
        },
        {
          "id": "MET-IDEN-EXPIRED-GRANT",
          "metric": "Expired grants active",
          "threshold": "0"
        },
        {
          "id": "MET-IDEN-DATA-ROUTE",
          "metric": "Impermissible data routes",
          "threshold": "0"
        },
        {
          "id": "MET-IDEN-BOUNDARY-FAIL",